{
  "schemaVersion": 1,
  "kind": "pairing.request",
  "spaceId": "space_demo0001",
  "senderNodeId": "node_demo0001",
  "recipientNodeId": "node_demo0002",
  "taskId": "task_demo0001",
  "nonce": "synthetic-nonce-00000001",
  "issuedAt": "2026-09-04T11:59:00Z",
  "expiresAt": "2026-09-04T12:05:00Z",
  "payload": {
    "displayName": "Synthetic Mac node",
    "ephemeralPublicKey": "c3ludGhldGljLWVwaGVtZXJhbC1wdWJsaWMta2V5LTAwMDE=",
    "confirmationCode": "123456"
  }
}
